index,Unnamed: 0,id,text,exp_tag,amb_tag,extract_tag,tobacco_warning
937,937,backwoods_cigars 306,Tomorrow We are pulling up in Atlanta for our next round of Smokehouse Social with guest performance by lutewest9  Smokehouse Social is a Music based platform for “up and coming” artists The showcase style competition event is designed to amplify local creative talent develop brand advocates further brand positioning and provide professional opportunities for talent participants  Rsvp is required  httpswwweventbritecomethesmokehousesocialwithlutetickets63129776862 Free entry all night Music by datdjmalik  bdpsoundz Hosted By Skylyfee Powered By backwoodscigars  wjbpresents trilogypromotions jayham954 snoophoodsta mademenent datdjmalik cafecircalounge,False,False,#smokehousesocial  ,False
938,938,backwoods_cigars 312,nav is living his best life with ,False,False,#backwoods  #BackwoodsGang,False
939,939,backwoods_cigars 474,Tag your favorite dj👇👇👇 djscheme,False,False,None,False
940,940,backwoods_cigars 448,Caption this👇👇,False,False,None,False
941,941,backwoods_cigars 104,backwoods burner baby ,False,False,#backwoodsparty,False
942,942,backwoods_cigars 662,Where should we have our next event ,False,False,#backwoods,False
943,943,backwoods_cigars 676,benjibillboard knows how to make a presentation Listening party for his new album going down now alibiatl ,False,False,#notacelebrity  #billboardbenji  #backwoodscigars,False
944,944,backwoods_cigars 110,lmao you playin yourself if you aren’t prepared before what’s your drink of choice,False,False,None,False
945,945,backwoods_cigars 138,real fan test which one you choosing before opening,False,False,None,False
946,946,backwoods_cigars 39,hittin right ,False,False,#backwoods  #backwoodsforbreakfast,False
947,947,backwoods_cigars 11,what are you picking from this hall of fame ,False,False,#backwoods  #backwoodsparty,False
948,948,backwoods_cigars 689,Big Weekend Big Backwoods westcoastcure,False,False,None,False
949,949,backwoods_cigars 514,What’s your fav famousdex song👇👇👇,False,False,None,False
950,950,backwoods_cigars 272,what type of you want to see,False,False,#backwoodsmerch ,False
951,951,backwoods_cigars 266,choose your fighter kiddkuntry,False,False,#backwoods ,False
952,952,backwoods_cigars 500,Tag the last person you smoked with👇👇👇,False,False,None,False
953,953,backwoods_cigars 528,Good morning Say it back 🌞,False,False,None,False
954,954,backwoods_cigars 299,What a perfect way to relax ,False,False,#Backwoods  #AlwaysTrue,False
955,955,backwoods_cigars 598,An official challenge from sonnydigital ,False,False,#backwoods  #rollup,False
956,956,backwoods_cigars 201,whats your summer vibe ,False,False,#backwoodsparty,False
957,957,backwoods_cigars 567,Tag someone that needs these👇👇👇,False,False,None,False
958,958,backwoods_cigars 573,Tag a girl that can roll👇👇👇,False,False,None,False
959,959,backwoods_cigars 215,had to secure the bag for the next turn up ,False,False,#backwoodsparty,False
960,960,backwoods_cigars 229,whos ridin with dark stout,False,False,None,False
961,961,backwoods_cigars 76,which tray is better,False,False,None,False
962,962,backwoods_cigars 188,1 dark stout box isnt enough for the party ,False,False,#backwoodsparty,False
963,963,backwoods_cigars 62,blessed by the pack which one are you choosing first ,False,False,#backwoodsparty,False
964,964,backwoods_cigars 89,can’t talk im busy,False,False,None,False
965,965,backwoods_cigars 611,Caption this👇👇👇,False,False,None,False
966,966,backwoods_cigars 177,favorite pack ,False,False,#backwoodsparty,False
967,967,backwoods_cigars 163,that behind finna take a seat after that dark leaf hits back lmaooo,False,False,None,False
968,968,backwoods_cigars 605,caption this 👇👇👇quavohuncho ,False,False,#happybirthday,False
969,969,backwoods_cigars 639,Whats your favorite famousdex song👇👇👇,False,False,None,False
970,970,backwoods_cigars 375,Tag a female that can prepare a perfect backwood👇👇👇,False,False,None,False
971,971,backwoods_cigars 413,Who would eat this Backwood sushi roll 😂😂😂,False,False,None,False
972,972,backwoods_cigars 407,How many backwoods do you smoke on a night out,False,False,None,False
973,973,backwoods_cigars 361,Mood after a few woods,False,False,None,False
974,974,backwoods_cigars 349,Tag someone that smokes like sosamann 👇👇👇 last comment 🥇,False,False,None,False
975,975,backwoods_cigars 348,Tag someone that needs our merch👇👇👇 offical merch is only available at our events ,False,False,#backwoodsfam,False
976,976,backwoods_cigars 406,When you don’t want your backwood to get lonely 😂,False,False,None,False
977,977,backwoods_cigars 360,Get busy👇👇👇,False,False,None,False
978,978,backwoods_cigars 374,Drop your city 👇👇👇,False,False,None,False
979,979,backwoods_cigars 412,Before and after  Send us pics of your creative solutions to repurpose empty backwood packs,False,False,None,False
980,980,backwoods_cigars 638,What’s in your pockets today,False,False,None,False
981,981,backwoods_cigars 162,real hot girl shit ,False,False,#backwoodsbaddie,False
982,982,backwoods_cigars 604,Drop your city👇👇👇 masonrayparker,False,False,None,False
983,983,backwoods_cigars 610,Who put you on to 👇👇👇,False,False,#backwoods,False
984,984,backwoods_cigars 88,lmao you gotta be jokin bruh,False,False,None,False
985,985,backwoods_cigars 176,night time kickback ,False,False,#backwoodsparty,False
986,986,backwoods_cigars 63,stuffed ,False,False,#backwood,False
987,987,backwoods_cigars 77,its mornings like these ,False,False,#backwoods,False
988,988,backwoods_cigars 189,og party for ogs only ,False,False,#backwoodsparty,False
989,989,backwoods_cigars 228,send us your immortalman,False,False,#backwoodsart  ,False
990,990,backwoods_cigars 572,What’s your favorite place to smoke👇👇👇,False,False,None,False
991,991,backwoods_cigars 214,who got the best producer tag too,False,False,None,False
992,992,backwoods_cigars 200,good morning,False,False,None,False
993,993,backwoods_cigars 566,🗣🗣🗣 you can only get our merch at one of our events Pull up to 1upla on the 15th,False,False,None,False
994,994,backwoods_cigars 599,Tag the last girl you smoked with 👇👇👇,False,False,None,False
995,995,backwoods_cigars 216,who’s up ,False,False,#backwoodsparty,False
996,996,backwoods_cigars 570,Read about it📚📚 famousdex ,False,False,#backwoods,False
997,997,backwoods_cigars 564,Thoughts👇👇👇,False,False,None,False
998,998,backwoods_cigars 202,if she sparks the wood for you she a real one ,False,False,#backwoodsparty,False
999,999,backwoods_cigars 558,Whats your favorite nolimitherbo song👇👇👇,False,False,None,False
1000,1000,backwoods_cigars 49,the dark ones just be hittin harder lmao,False,False,None,False
1001,1001,backwoods_cigars 61,straight up ,False,False,#backwoods,False
1002,1002,backwoods_cigars 75,go places ,False,False,#backwoodsparty,False
1003,1003,backwoods_cigars 606,Bay watch ,False,False,#backwoods  #rollup,False
1004,1004,backwoods_cigars 160,themontaguenetwork keep that same energy,False,False,None,False
1005,1005,backwoods_cigars 174,what y’all on tonight ,False,False,#backwoodsparty,False
1006,1006,backwoods_cigars 612,Tag someone that needs these👇👇👇,False,False,None,False
1007,1007,backwoods_cigars 148,lil bit of a wild rum vibe ,False,False,#backwoodsparty,False
1008,1008,backwoods_cigars 389,Mood 😂😂😂,False,False,None,False
1009,1009,backwoods_cigars 362,honey 🍯,False,False,None,False
1010,1010,backwoods_cigars 404,What’s your favorite song RN👇👇👇,False,False,None,False
1011,1011,backwoods_cigars 410,Who do you know that can roll like a pro westcoastcure,False,False,None,False
1012,1012,backwoods_cigars 376,👍 or 👎,False,False,None,False
1013,1013,backwoods_cigars 438,Caption this👇👇👇,False,False,None,False
1014,1014,backwoods_cigars 439,Keep that same energy 🔋 We love our supporters,False,False,None,False
1015,1015,backwoods_cigars 411,last girl you smoked with👇👇👇,False,False,None,False
1016,1016,backwoods_cigars 377,Where should we come next👇👇👇 Official merch is ONLY available at our events,False,False,None,False
1017,1017,backwoods_cigars 363,What’s the best flavor👇👇👇,False,False,None,False
1018,1018,backwoods_cigars 405,Mood😂,False,False,None,False
1019,1019,backwoods_cigars 388,What’s in your bag coileray,False,False,None,False
1020,1020,backwoods_cigars 149,my type of cake ,False,False,#backwoodsparty,False
1022,1022,backwoods_cigars 613,Pick one👇👇👇 ,False,False,#backwoods  #exotics,False
1023,1023,backwoods_cigars 607,Tag your favorite female artist👇👇👇 cubanndasavage,False,False,None,False
1024,1024,backwoods_cigars 161,new ice gonna put the wood out,False,False,None,False
1025,1025,backwoods_cigars 74,i be searching the same 4 areas 50 times because i know nowhere else has a lighter then 30 mins later i find them in my pants,False,False,None,False
1026,1026,backwoods_cigars 60,roses are red,False,False,#backwoodsparty  #backwoods,False
1027,1027,backwoods_cigars 48,shoutout chamonaaaa,False,False,None,False
1028,1028,backwoods_cigars 559,Summer is around the corner ,False,False,#pooltime  #summer  #otw,False
1029,1029,backwoods_cigars 565,Rolling loud at rolling loud w hoodrichpablojuan westcoastcure,False,False,None,False
1030,1030,backwoods_cigars 203,who you inviting to this mega session ,False,False,#backwoodsparty,False
1031,1031,backwoods_cigars 217,send us what you’re smoking tonight ,False,False,#backwoods,False
1032,1032,backwoods_cigars 571,What’s your fav playboicarti song👇👇👇,False,False,None,False
1033,1033,backwoods_cigars 549,Mirror mirror on the wall who has the best backwood of them all,False,False,None,False
1034,1034,backwoods_cigars 575,Caption this👇👇👇,False,False,None,False
1035,1035,backwoods_cigars 213,willing to risk it all for moniquevilla ,False,False,#backwoodsparty,False
1036,1036,backwoods_cigars 207,views ,False,False,#backwoodsparty,False
1037,1037,backwoods_cigars 561,Tag someone that would consider this breakfast👇👇,False,False,None,False
1038,1038,backwoods_cigars 64,0 to 100 real quick,False,False,None,False
1039,1039,backwoods_cigars 70,we love ,False,False,#backwoodsart,False
1040,1040,backwoods_cigars 58,is this the best pack,False,False,None,False
1041,1041,backwoods_cigars 159,rare view not talkin woods ,False,False,#backwoodsparty,False
1042,1042,backwoods_cigars 165,it looks like backwoods is the new black ,False,False,#backwoodsparty,False
1043,1043,backwoods_cigars 603,About last night ,False,False,#backwoods,False
1044,1044,backwoods_cigars 617,Who has tried these ,False,False,#backwoods,False
1045,1045,backwoods_cigars 171,who’s tryna throw down ,False,False,#backwoodsparty,False
1046,1046,backwoods_cigars 398,Who wants to smoke a wood with the legend👇👇👇,False,False,None,False
1047,1047,backwoods_cigars 429,Make sure you got the tools of the trade,False,False,None,False
1048,1048,backwoods_cigars 401,😂😂😂,False,False,None,False
1049,1049,backwoods_cigars 367,Tag the last person you shared a wood with👇👇👇,False,False,None,False
1050,1050,backwoods_cigars 373,What’s your thoughts on singles,False,False,None,False
1051,1051,backwoods_cigars 415,Who likes honey berry,False,False,None,False
1052,1052,backwoods_cigars 372,Perfect morning  tag the team👇👇👇 westcoastcure,False,False,None,False
1053,1053,backwoods_cigars 414,favorite female artist👇👇👇,False,False,None,False
1054,1054,backwoods_cigars 400,Fun fact sonnydigital uses backwoods in every studio session,False,False,None,False
1055,1055,backwoods_cigars 366,What’s your fav flavor👇👇👇,False,False,None,False
1056,1056,backwoods_cigars 428,Up in smoke ,False,False,#alwaystrue,False
1057,1057,backwoods_cigars 399,We got moves on deck,False,False,None,False
1058,1058,backwoods_cigars 616,Started a new wave blocboyjb time to celebrate with some vanillas ,False,False,#backwoods  #rollup  #rare,False
1059,1059,backwoods_cigars 170,choose a 5 pack and 2 singles ,False,False,#backwoodsparty,False
1060,1060,backwoods_cigars 164,who needs a session,False,False,#backwoods ,False
1061,1061,backwoods_cigars 602,Tag some that needs to try these👇👇👇 officialhollywoods,False,False,None,False
1062,1062,backwoods_cigars 158,littlebihhh that shit unreal,False,False,None,False
1063,1063,backwoods_cigars 59,tag the go to 100 pearl accuracy only the no mess up,False,False,None,False
1064,1064,backwoods_cigars 71,blessed by the 1 pack,False,False,None,False
1065,1065,backwoods_cigars 65,ogs stay fresh ,False,False,#backwoodsparty,False
1066,1066,backwoods_cigars 206,how do you start your day,False,False,None,False
1067,1067,backwoods_cigars 560,Miss you forever 🙏🙏🙏 fredosantanassr,False,False,None,False
1068,1068,backwoods_cigars 574,Tag your squad👇👇👇,False,False,None,False
1069,1069,backwoods_cigars 212,triple threat ,False,False,#backwoodsparty,False
1070,1070,backwoods_cigars 548,Who likes 🌹 Made by crosk,False,False,None,False
1071,1071,backwoods_cigars 589,TAG SOMEONE IN LOS ANGELES 👇👇👇This morning were pulling up 1upla with some exclusive merch 1340 W Florence Ave Los Angeles CA  90044,False,False,#backwoods ,False
1072,1072,backwoods_cigars 238,then she acts like its hittin but its really not smh,False,False,None,False
1073,1073,backwoods_cigars 562,Attn peep the smile and Show some love to jodyhighroller for rolling his first solid backwood 😀 we got the legend training now  Just wait for whats next,False,False,None,False
1074,1074,backwoods_cigars 204,east side reppin,False,False,None,False
1075,1075,backwoods_cigars 210,im not looking at the wood when you pass that to me chamonaaaa,False,False,None,False
1076,1076,backwoods_cigars 576,Whats your fav lilskies song👇👇👇,False,False,None,False
1078,1078,backwoods_cigars 67,its morning again,False,False,None,False
1079,1079,backwoods_cigars 199,call the squad we finna have the bigggest session of all time ,False,False,#backwoodsparty,False
1080,1080,backwoods_cigars 9,who thinks this is pearled,False,False,None,False
1081,1081,backwoods_cigars 628,Tag an artist you want to see perform in AustinTexas this week👇👇👇 we got a surprise for someone,False,False,None,False
1082,1082,backwoods_cigars 172,aye,False,False,None,False
1083,1083,backwoods_cigars 614,Happy bday ridiculouslyryan  ,False,False,#rollup  #backwoods,False
1084,1084,backwoods_cigars 600,Weekends or weekdays👇👇👇,False,False,None,False
1085,1085,backwoods_cigars 98,natural habitat,False,False,None,False
1086,1086,backwoods_cigars 166,g shit litokirinosg ,False,False,#backwoodsparty,False
1087,1087,backwoods_cigars 358,Who wants to try these,False,False,None,False
1088,1088,backwoods_cigars 416,Drop an emoji if you tried these,False,False,None,False
1089,1089,backwoods_cigars 370,What’s your favorite richthekid song👇👇👇,False,False,None,False
1090,1090,backwoods_cigars 364,Mood all 2019 🌅 souljaboy,False,False,None,False
1091,1091,backwoods_cigars 402,Drop your area code👇👇👇,False,False,None,False
1092,1092,backwoods_cigars 365,Drop your city👇👇👇,False,False,None,False
1093,1093,backwoods_cigars 403,Psa Go get the bag this morning,False,False,None,False
1094,1094,backwoods_cigars 417,Who is the first person you call to share a backwood with,False,False,None,False
1095,1095,backwoods_cigars 371,Tag someone that needs to try these👇👇👇,False,False,None,False
1096,1096,backwoods_cigars 359,What city smokes the most backwoods,False,False,None,False
1097,1097,backwoods_cigars 99,who needs one,False,False,None,False
1098,1098,backwoods_cigars 601,Plug walk richthekid 📷 shotbycones,False,False,#backwoods  #rollup ,False
1099,1099,backwoods_cigars 167,choose your favorite box ,False,False,#backwoodsparty,False
1100,1100,backwoods_cigars 173,these the top 3 types of woods ,False,False,#backwoodsparty,False
1101,1101,backwoods_cigars 615,what’s your thoughts on this flavor👇👇👇,False,False,None,False
1102,1102,backwoods_cigars 629,Match the pack ,False,False,#honey  #nailsdid,False
1103,1103,backwoods_cigars 8,tag someone you want to wake up and smoke with,False,False,None,False
1104,1104,backwoods_cigars 66,only big wood smokers can like this,False,False,None,False
1106,1106,backwoods_cigars 72,tag who you reeling in 👇🏾👇🏾👇🏾,False,False,None,False
1107,1107,backwoods_cigars 211,rare ,False,False,#backwoodsfiesta,False
1108,1108,backwoods_cigars 577,Rate honey 110 and why👇👇👇,False,False,None,False
1109,1109,backwoods_cigars 563,Lets get rollin today theashleydee ,False,False,#backwoods  #rollup,False
1110,1110,backwoods_cigars 205,name the pack iykyk ,False,False,#backwoodsparty,False
1111,1111,backwoods_cigars 239,tag a girl who can roll,False,False,None,False
1112,1112,backwoods_cigars 588,So to the man himself youngdolph Today was an awesome day Hope yours was as great as ours 🐬🐬🐬 • • • ,False,False,#backwoodscigars  #streetexecs  #youngdolph  #itsmokelikeitsmell,False
1113,1113,backwoods_cigars 585,Breakfast is served ,False,False,#backwoods  #vanilla,False
1114,1114,backwoods_cigars 591,Tag a girl that rolls like a pro👇👇👇,False,False,None,False
1115,1115,backwoods_cigars 220,you know what to do 👇🏾,False,False,None,False
1116,1116,backwoods_cigars 546,Pick one👇👇👇,False,False,None,False
1117,1117,backwoods_cigars 552,Tag your favorite female artist 👇👇 cubanndasavage,False,False,#backwoods  #rollup ,False
1118,1118,backwoods_cigars 234,do the dash in the whip 🔥 ,False,False,#backwoodsart  #backwoods,False
1119,1119,backwoods_cigars 208,we throwin a dark stout or honey berry party ,False,False,#backwoodsparty,False
1120,1120,backwoods_cigars 195,who needs a tray,False,False,None,False
1121,1121,backwoods_cigars 181,stop playin with us ,False,False,#backwoodsparty,False
1122,1122,backwoods_cigars 57,one time wasnt enough,False,False,None,False
1123,1123,backwoods_cigars 5,shoutout therealtrapkitchen the food be bussin always,False,False,None,False
1124,1124,backwoods_cigars 43,packed,False,False,None,False
1125,1125,backwoods_cigars 630,Show some love 💚 30 day countdown  600breezy  ,False,False,#family  #seeyousoon  #throwback2016,False
1126,1126,backwoods_cigars 156,is this facts lol,False,False,None,False
1127,1127,backwoods_cigars 142,always chase the bag ,False,False,#backwoodsparty,False
1128,1128,backwoods_cigars 624,Whats your pets name👇👇👇 mafiabwcc got Burberry and Balmain,False,False,None,False
1129,1129,backwoods_cigars 94,perfect tatt with the perfect wood,False,False,None,False
1130,1130,backwoods_cigars 80,dis shit natural,False,False,None,False
1131,1131,backwoods_cigars 618,Good morning ,False,False,#rollup,False
1132,1132,backwoods_cigars 397,Where should we visit👇👇👇,False,False,None,False
1133,1133,backwoods_cigars 383,What’s your daily essentials 👇👇👇,False,False,None,False
1134,1134,backwoods_cigars 354,What’s 2 things you never leave home without,False,False,None,False
1135,1135,backwoods_cigars 432,Pick one👇👇👇,False,False,None,False
1136,1136,backwoods_cigars 426,Sometimes you have to be selfish ,False,False,#justforme,False
1137,1137,backwoods_cigars 340,What’s your fav nav song ,False,False,#backwoodsfam,False
1138,1138,backwoods_cigars 368,Tag your fav producer👇👇👇,False,False,None,False
1139,1139,backwoods_cigars 369,Tag the last female you smoked with👇👇👇,False,False,None,False
1140,1140,backwoods_cigars 427,You know the vibes ,False,False,#backwoods,False
1141,1141,backwoods_cigars 341,Rare species ,False,False,#exoticbackwoods,False
1142,1142,backwoods_cigars 355,Tag the last female you smoked with👇👇,False,False,None,False
1143,1143,backwoods_cigars 433,zmoneyworld is from Chicago Drop your city below👇👇,False,False,None,False
1144,1144,backwoods_cigars 382,What’s the first thing you do in the morning,False,False,None,False
1145,1145,backwoods_cigars 396,Who would you share this with👇👇👇 westcoastcure,False,False,None,False
1146,1146,backwoods_cigars 619,Caption this👇👇👇 quavohuncho,False,False,None,False
1147,1147,backwoods_cigars 81,big weekend energy,False,False,None,False
1148,1148,backwoods_cigars 95,parties are lit,False,False,#backwoods ,False
1149,1149,backwoods_cigars 143,which is the go to ,False,False,#backwoodsparty,False
1150,1150,backwoods_cigars 625,International love from our guy chrtkeithape rocking backwoods for his photo shoot with yohoboy in Asia,False,False,None,False
1151,1151,backwoods_cigars 631,Sunday vibes ,False,False,#rollup,False
1153,1153,backwoods_cigars 42,mask go hard,False,False,#backwoods ,False
1154,1154,backwoods_cigars 56,backwoods sword by thegrasshoppa,False,False,None,False
1155,1155,backwoods_cigars 4,name a better duoill wait ,False,False,#backwoodsparty,False
1156,1156,backwoods_cigars 180,what 2 woods would you make a bag out of,False,False,None,False
1157,1157,backwoods_cigars 194,🍑👀,False,False,None,False
1158,1158,backwoods_cigars 209,I swear I be smashing some dank food at 3am then I wake up in the morning and realize I ate the food version of they really let themself go”,False,False,None,False
1159,1159,backwoods_cigars 553,Good morning from Miami 🏝 ,False,False,#backwoods  #poolside,False
1160,1160,backwoods_cigars 235,“yo you tryna ash that first,False,False,None,False
1161,1161,backwoods_cigars 221,peep the tatt,False,False,None,False
1162,1162,backwoods_cigars 547,How many backwoods did you smoke yesterday👇👇👇,False,False,None,False
1163,1163,backwoods_cigars 590,Mood 💰torylanez,False,False,None,False
1164,1164,backwoods_cigars 584,Rate our stout 110 and why👇👇👇,False,False,None,False
1165,1165,backwoods_cigars 592,What’s your fav flavor,False,False,None,False
1166,1166,backwoods_cigars 586,What’s your favorite travisscott somg👇👇👇,False,False,None,False
1167,1167,backwoods_cigars 237,which one yall pickin let us know in comments,False,False,None,False
1168,1168,backwoods_cigars 551,Drop your city👇👇👇,False,False,None,False
1169,1169,backwoods_cigars 545,Tag a dope visual artist we should know about👇👇👇,False,False,None,False
1170,1170,backwoods_cigars 223,stop playin you know how we do ,False,False,#backwoodsparty,False
1171,1171,backwoods_cigars 579,Drop an emoji👇👇👇 hoodrichpablojuan dykrazy worldstar,False,False,#flawless  #mpr1017 ,False
1172,1172,backwoods_cigars 182,car fire she fire 🔥🔥,False,False,None,False
1173,1173,backwoods_cigars 196,2 five packs or 10 one packs ,False,False,#backwoodsparty,False
1174,1174,backwoods_cigars 68,shits perfect no cap,False,False,None,False
1175,1175,backwoods_cigars 40,ima put you onto some game kings and queens,False,False,None,False
1176,1176,backwoods_cigars 6,Happy Holidays fam What did you do today ,False,False,#backwoods  #backwoodsparty,False
1177,1177,backwoods_cigars 54,idk bout yall but that outside is cutttttin ima be inside chillin in my heat smoking a wood,False,False,None,False
1178,1178,backwoods_cigars 627,Love is stronger than hate cdothoncho ,False,False,#backwoods  #rollup,False
1179,1179,backwoods_cigars 141,banana bank ,False,False,#backwoodsparty,False
1180,1180,backwoods_cigars 155,these go hard,False,False,None,False
1181,1181,backwoods_cigars 633,Breakfast of champions ,False,False,#Rollup  #backwoods,False
1182,1182,backwoods_cigars 83,dm us what youre smoking tonight ,False,False,#backwoodsparty,False
1183,1183,backwoods_cigars 169,whats the most laid back smoke spot,False,False,None,False
1184,1184,backwoods_cigars 97,double gauge,False,False,None,False
1185,1185,backwoods_cigars 380,Rate these 110👇👇👇,False,False,None,False
1186,1186,backwoods_cigars 394,last girl you smoked a backwood with👇👇👇,False,False,None,False
1187,1187,backwoods_cigars 343,Who wants new music by torylanez ,False,False,#backwoodsfam,False
1188,1188,backwoods_cigars 425,At the end of a long day💨💨,False,False,None,False
1189,1189,backwoods_cigars 431,If you like these drop a 🍯,False,False,None,False
1190,1190,backwoods_cigars 357,Tag someone that makes you laugh👇👇👇,False,False,None,False
1191,1191,backwoods_cigars 419,Caption this👇👇👇,False,False,None,False
1192,1192,backwoods_cigars 418,The biggest backwood we have seen in a while comethazine,False,False,None,False
1193,1193,backwoods_cigars 430,Tag someone that needs to try these👇👇👇,False,False,None,False
1194,1194,backwoods_cigars 356,Tag a mom👇😂👇😂👇,False,False,None,False
1195,1195,backwoods_cigars 342,New merch going crazy ,False,False,#backwoodsfam,False
1196,1196,backwoods_cigars 424,Tag a friend that rolls the biggest backwoods👇👇👇,False,False,None,False
1197,1197,backwoods_cigars 395,What’s your fav song right now,False,False,None,False
1198,1198,backwoods_cigars 381,Tag your favorite artist👇👇👇,False,False,None,False
1199,1199,backwoods_cigars 168,shoutout to all the singles ,False,False,#backwoodsparty,False
1200,1200,backwoods_cigars 96,me every time i walk into a gas station ,False,False,#backwoodsparty,False
1201,1201,backwoods_cigars 82,you can never forget your first ,False,False,#backwood,False
1202,1202,backwoods_cigars 154,who got some banana ,False,False,#backwoodsparty,False
1203,1203,backwoods_cigars 632,When pops stops you on the street for the 🍪🍪🍪 richthekid ,False,False,#nyc  #backwoods  #plugwalk,False
1204,1204,backwoods_cigars 626,who you would smoke these with👇👇👇 westcoastcure,False,False,None,False
1205,1205,backwoods_cigars 140,wood morning fam,False,False,#backwoods ,False
