index,Unnamed: 0,id,text,exp_tag,amb_tag,extract_tag,tobacco_warning
610,610,swishersweets 243,Strawberry is giving off some serious spring vibez rn Strawberry is giving off some serious spring vibez rn,False,False,None,False
611,611,swishersweets 257,Double tap if you always save room for Chocolate,False,False,None,False
612,612,swishersweets 531,Honey who shrunk the Sticky Sweets Now available in MINI cigarillos    ,False,False,#SwisherSweets  #MiniCigarillos  #StickySweets  #Swishers  #SmokeBreak  #LightItUp  #Cigarstagram  #CigarsOfInstagram  #SinceDayOne,False
613,613,swishersweets 519,Steady dripping Swisher Link in bio    ,False,False,#SwisherSweets  #Swishers  #HatGame  #SinceDayOne  #RideOrDie  #SwisherMerch  #GirlsWhoSmoke  #Lids,False
614,614,swishersweets 727,It’s about time    ,False,False,#SwisherSweets  #SwisherDiamonds  #Cigarillos  #Cigar  #SmokeBreak  #Cigarstagram,False
615,615,swishersweets 733,got all the way turnt up with iamtravisporter  urdjuice at last year Were bringing the next generation for 2018 Stay tuned    ,False,False,#ATL  #PackNightAtlanta  #ItsGoingDown  #SwisherSweets  #Swisher  #SwisherSweet  #RoscoeDash  #AllTheWayTurntUp  #TravisPorter  #HipHop  #SwisherArtistProject,False
616,616,swishersweets 690,Everything must go Use coupon code SWISHER20 to save 20 today on ANYTHING and EVERYTHING in the Swisher Gear online shop while supplies last Hit up httpsswishergearcom   ,False,False,#LinkInBio  #Swag  #SwisherGear  #SwisherLife  #SwisherSweets  #FlashSale  #SwisherSweets  #Swishers,False
617,617,swishersweets 684,Shout out to the real ones Tag your  No fakes    ,False,False,#SwisherSweeties #SwisherSweets  #BabesWhoSmoke  #GirlsWhoSmoke  #PoolParty  #SmokeBreak  #CoastalCocktail  #SummerVibes,False
618,618,swishersweets 34,What’s the move tonight This This is the move Swisher Sweets Green in a Limited Time Camo Packaging It won’t be here forever so get on it while you can ,False,False,#SSGreen  #SSCamo   #SSlimitededition,False
619,619,swishersweets 20,3 artists 3 recipients and 35k Stay tuned to see who DaBaby TylaYaweh and BrantleyGilbert award with the Swisher Sweets Artist Project Hometown Grants  ,False,False,#SSArtistProject  #SSAPGrant  #LifeIsSweet,False
620,620,swishersweets 135,Why chase a rock when you can smoke Diamonds,False,False,None,False
621,621,swishersweets 653,Reminiscing back to 4 years ago when the Artist Project was just getting started We connected with Ponce in LA for one of the first CStore Sessions In that same year we linked up with Kelechi to perform at our first ever Atlanta Pack Night Now they’re stealing the red carpet together Show our fam some love follow poncetv  kelechief and check out their music    ,False,False,#SwisherArtistProject  #SwisherSweets  #ATL  #ATLiens  #ATLRappers  #ATLMusic  #ATLMusicScene  #PackNightAtlanta,False
622,622,swishersweets 647,We partnered with lifeofdesiigner to award a 3000 grant to one hardworking musician Applications are open now through October 22nd Apply today Link in bio  ,False,False,#SwisherArtistProject  #Desiigner  #SwisherSweetsArtistProject  #GrantProgram  #EnterToWin,False
623,623,swishersweets 121,Summer days call for a Swisher Sweets Original Red Post up poolside with your favorite pouch and let the good vibes begin ,False,False,#SummerEdition  #SummerPromo  #SummerIsSweet,False
624,624,swishersweets 109,You know shes a real one if she burns the Original blend  ,False,False,#SSNaturalLeaf,False
625,625,swishersweets 492,Have your cake and smoke it too 😉😂    ,False,False,#SwisherSweets  #Swishers  #Cigarstagram  #Cigarillos  #SpecialBlend  #SmokeBreak  #LightItUp,False
626,626,swishersweets 486,The people’s champ Drop a 🏆 in the comments if you voted to bring Sticky Sweets back as our latest     ,False,False,#EncoreEdition #SwisherSweets  #Swishers  #Cigarstagram  #Cigarillos  #EncoreEdition  #StickySweets  #SmokeBreak  #LightItUp  #CigarsofInstagram,False
628,628,swishersweets 337,Double tap if you want some Diamonds under the tree this year,False,False,None,False
629,629,swishersweets 323,Interrupting your scrolling with an important message Its the FREAKIN WEEKEND fam get the Green Sweets and get out there,False,False,None,False
630,630,swishersweets 445,💥 goes the Cherry Dynamite,False,False,None,False
631,631,swishersweets 479,You just won the Spark Award  who you callin Tag below 👇    ,False,False,#SparkParty2019  #SwisherArtistProject,False
632,632,swishersweets 478,You BETTER be riding with the Green Sweets today    ,False,False,#SwisherSweets  #Swishers  #Cigarstagram  #Cigarillos  #SmokeBreak  #LightItUp  #CigarsofInstagram  #GreenSweets  #MiniCigarillos,False
633,633,swishersweets 322,Who is ready for some in the 305 Dont miss dababy on the Swisher Sweets Artist Project Stage at shaqsfunhouse on 131 Ticket link in bio ,False,False,#VIBEZ  #KIRK,False
634,634,swishersweets 444,Hobbies include long bike rides with Tropical Fusion,False,False,None,False
636,636,swishersweets 336,Looks like Swishmas came early this year 🔥,False,False,None,False
637,637,swishersweets 487,More like choclit Double tap if this is the goto    ,False,False,#SwisherSweets  #Swishers  #Cigarstagram  #Cigarillos  #ClassicBlend  #SmokeBreak  #LightItUp  #CigarsofInstagram,False
638,638,swishersweets 493,Its ok to skip dessert    ,False,False,#SwisherSweets  #Swishers  #SweetCream  #LimitedEdition  #Cigarstagram  #SmokeBreak  #LightItUp  #SinceDayOne,False
639,639,swishersweets 108,These moments feel like a year ago and yesterday all at the same time Lets never take these moments for granted again Because its the little moments that remind us that These moments feel like a year ago and yesterday all at the same time Lets never take these moments for granted again Because its the little moments that remind us that ,False,False,#LifeIsSweet  #LifeIsSweet,False
640,640,swishersweets 646,Have you tried Green Sweets There’s no time like the present     ,False,False,#GreenSweets  #SwisherSweets  #Swisher  #SinceDayOne  #SwisherClassic  #SmokeBreak  #LightItUp,False
641,641,swishersweets 120,Thats the motto ,False,False,#LifeIsSweet,False
642,642,swishersweets 134,That moment when you get to lean back and fire up your favorite Swisher Sweets ,False,False,#LifeIsSweet,False
643,643,swishersweets 652,Is your crew down with Coco Blue Tag ‘em 👇👇    ,False,False,#LimitedEdition  #LimitedTime  #Coco  #Party  #PartyTime  #GetLit  #SmokeBreak  #LightItUp  #CocoBlue,False
644,644,swishersweets 21,Let’s end this year on a high note All gear is 25 off for the ENTIRE month  free shipping ,False,False,#LinkInBio  #SSGear,False
645,645,swishersweets 35,Those crisp Fall twilights are our favorite part of November Get out there and enjoy it tonight fam The holidays are right around the corner ,False,False,#LifeIsSweet,False
646,646,swishersweets 685,DoubleTap if you double up    ,False,False,#SwisherSweets  #EncoreEdition  #SmokeBreak  #LightItUp  #SmokeSesh  #SundayFunday,False
647,647,swishersweets 691,This could be you but you playin Put the S on your chest and make it a Swisher summer Get 20 off anything in our online shop today using coupon code SWISHER20 Hurry before these pieces are gone forever Link in bio     ,False,False,#Swag  #SwisherGear  #SwisherLife  #SwisherSweets  #FlashSale  #SwisherSweets  #Swishers,False
648,648,swishersweets 732,Rather than staying on the outside I like that Swisher got into the culture From Pack Night Atlanta all the way to sharing a stage with  based rapper kelechief took full advantage of the opportunity to partner with the     ,False,False,#CardiB #ATL #SwisherArtistProject #SwisherSweets  #Swisher  #ComeUp  #HipHop  #ComingSoon,False
649,649,swishersweets 726,It’s all love when you live the    ,False,False,#SwisherLife  #SwisherSweets  #Swishers  #wegotlove  #DapUp  #SmokeBreak  #NightLife  #SwisherMango,False
650,650,swishersweets 518,Have you tried Sweet Cream yet Comment 👅 below if youre loving our latest Limited Edition blend    ,False,False,#SwisherSweets  #Swishers  #SweetCream  #LimitedEdition  #Cigarstagram  #CigarsOfInstagram  #SmokeBreak  #LightItUp  #SinceDayOne,False
651,651,swishersweets 256,tylayaweh yellabeezy214 melii djnittigritti,False,False,None,False
652,652,swishersweets 530,Which blend are you smoking today    ,False,False,#SwisherSweets  #Swishers  #SmokeBreak  #SinceDayOne  #TuesdayVibes  #Cigarillos  #LightItUp,False
653,653,swishersweets 524,Comment 💔 below if bae got you roses for Valentines Day but all you wanted was Sweet Cream    ,False,False,#SwisherSweets  #Swishers  #SweetCream  #LimitedEdition  #Cigarstagram  #SmokeBreak  #LightItUp  #SinceDayOne,False
654,654,swishersweets 242,The new fit thats almost in your closet Grab it with the link in our bio ,False,False,#SSGear,False
655,655,swishersweets 295,EPIC night Check the highlight to see what went down at Shaq’s Fun House,False,False,None,False
656,656,swishersweets 281,Yall This new line is outta control Head to the link in our bio to shop and use NEW25 for 25 off your ENTIRE order🔥,False,False,None,False
657,657,swishersweets 297,2020 had some legends come through Hit the highlight to see it all,False,False,#SparkAwards ,False
658,658,swishersweets 283,From 0 to in 3 seconds Tag yourselves,False,False,#SPARKPARTY ,False
659,659,swishersweets 532,True to the streets     ,False,False,#SinceDayOne  #SwisherSweets  #Swishers  #SmokeBreak  #RideOrDie  #Cigarillos  #LightItUp,False
660,660,swishersweets 254,Who breaks their green out starting March 1st Let us know below  ,False,False,#SSblends  #GreenSweets  #ClassicBlends,False
661,661,swishersweets 240,When he tells you to give his hoodie back Link in bio to snag your own ,False,False,#SSGear,False
662,662,swishersweets 526,Short  Sticky Sweet Who’s game for a MINI break    ,False,False,#SwisherSweets  #MiniCigarillos  #StickySweets  #Swishers  #SmokeBreak  #LightItUp  #Cigarstagram  #CigarsOfInstagram  #SinceDayOne,False
663,663,swishersweets 268,The begins Which Swisher Sweets blend do you want to see back in rotation All you need to do is hit the link in the bio and vote for your favorite blend once per day Voting ends on 228 ,False,False,#BlendBattle  #Lettheblendbattlebegin,False
664,664,swishersweets 730,The is proud to announce our 2018 Pack Night Tour headliners Give it up for Gucci Mane Fetty Wap Desiigner and Machine Gun Kelly Follow the link in our bio for the full tour details,False,False,#SwisherArtistProject ,False
665,665,swishersweets 724,Have you tried this exclusive blend Boozy Watermelon is available now but only at 7Eleven Get you some    ,False,False,#SwisherSweets  #Exclusive  #7Eleven  #BoozyWatermelon  #LimitedEdition  #Watermelon,False
666,666,swishersweets 718,Gunner we can’t Let You Go We teamed up with MachineGunKelly for not one but TWO Pack Night headlining performances this year Holler at ya boy in Philadelphia and Houston More info at apswishersweetscom or follow the link in our bio    ,False,False,#SwisherSweets  #SwisherArtistProject  #HipHop  #ComingSoon  #MGK  #MachineGunKelly  #EST4Life,False
667,667,swishersweets 687,Have you tried Coastal Cocktail Make sure you stock up while supplies last Just like all our Limited Edition blends it won’t be around forever     ,False,False,#CoastalCocktail  #SwisherSweets  #LimitedEdition   #SmokeBreak  #LightItUp  #Swishers  #Cigarstagram  #SmokeofTheDay,False
668,668,swishersweets 693,The is awarding four grants to musicians in partnership with each of our Pack Night headliners Get details and apply for the 1000 FettyWap1738 grant today at the link in our bio     ,False,False,#SwisherArtistProject  #SwisherSweets  #FettyWap  #EnterToWin  #MusicNews  #NewMusic  #ComeUp  #GrantProgram  #HipHop,False
669,669,swishersweets 23,Minding my own business at family functions like✌️,False,False,None,False
670,670,swishersweets 37,Big mood,False,False,None,False
671,671,swishersweets 122,Nothing says chill out like that first pull from a BLK Double tap if our tip cigarillo is your goto when you need to get away,False,False,None,False
672,672,swishersweets 644,With 3 in a pack there’s always enough to go around,False,False,None,False
673,673,swishersweets 650,Heads up emerging artists the next grant opportunity is here This time we’re upping the ante by partnering with LifeOfDesiigner to award 3000 to help one artist advance their music career Hit the link in our bio for details    ,False,False,#ArtistProject  #Desiigner  #SwisherSweetsArtistProject  #GrantProgram  #EnterToWin,False
674,674,swishersweets 136,Keep the beach vibes going with a pouch of our Swisher Sweets Original Red cigarillo With four fresh options we know well have one that matches your fit ,False,False,#4thofJuly  #SummerEdition  #SummerPromo  #SummerIsSweet,False
675,675,swishersweets 678,Trust us you DO NOT want to miss out on MachineGunKelly’s set at the Philly edition of  Cop your tickets at the link in our bio    ,False,False,#PackNight #MachineGunKelly  #TheGunner  #MGK  #SwisherSweets  #PhillyMusic  #PhillyNews  #SwisherArtistProject  #PackNightPhilly,False
676,676,swishersweets 485,Stay locked into our Instagram as we are honoring iamcardib as the Spark Award recipient tonight🎉🍾    ,False,False,#SparkParty2019  #SwisherArtistProject,False
677,677,swishersweets 491,We love a good lemon bar as much as the next guy but we love FOOLING you even more Tag your friends below who believed our last post 👇😂    ,False,False,#SwisherSweets  #Swishers  #Cigarstagram  #Cigarillos  #SpecialBlend  #SmokeBreak  #LightItUp  #AprilFools  #Jokes,False
678,678,swishersweets 446,On my way to Taco Tuesday like,False,False,None,False
679,679,swishersweets 320,It might be cold outside but we are in a palm tree state of mind,False,False,None,False
680,680,swishersweets 334,That postholiday Swisher just hits different,False,False,None,False
681,681,swishersweets 452,She knows what’s good 👀    ,False,False,#SmokeBreak  #LightItUp  #Swishers  #SwisherSweets  #Cigarstagram  #Cigarillos  #SinceDayOne  #SummerVibes  #Grape  #Classics,False
682,682,swishersweets 308,Flashback to the last two trailblazing Spark recipients We are announcing the 2020 recipient TOMORROW Stay locked in to find out all the details,False,False,#SparkAward ,False
683,683,swishersweets 309,Need a resolution How about share your cigarillos,False,False,None,False
684,684,swishersweets 335,Best tree ever Merry Christmas ,False,False,#SwisherFam,False
685,685,swishersweets 453,Friends don’t let friends sleep on their favorite blends tag below who youre telling bout Summer Twist    ,False,False,#SmokeBreak  #LightItUp  #Swishers  #SwisherSweets  #Cigarstagram  #Cigarillos  #SinceDayOne  #SummerVibes  #LimitedEdition  #LemonTwist,False
687,687,swishersweets 321,Who are you sharing your pouch with Let us know,False,False,None,False
689,689,swishersweets 484,The 👑 iamcardib is in the house    ,False,False,#SparkAward2019  #SwisherArtistProject,False
690,690,swishersweets 679,The Gunner takes the stage next weekend for Philly Pack Night Limited tickets are available at the link in our bio    ,False,False,#MachineGunKelly  #TheGunner  #MGK  #SwisherSweets  #PhillyMusic  #PhillyNews  #SwisherArtistProject  #PackNightPhilly,False
691,691,swishersweets 651,Don’t miss your chance to try Limited Edition Boozy Watermelon Soon this blend will be gone for good    ,False,False,#TearIntoTheWeekend  #BoozyWatermelon  #LimitedEdition  #LightItUp  #GetLit  #SmokeBreak  #Swishers  #SwisherSweets,False
692,692,swishersweets 137,Doubletap if youre about that MINI life ,False,False,#SSmini,False
694,694,swishersweets 645,Let’s get this party started,False,False,None,False
695,695,swishersweets 36,Double tap if grape is your favorite ,False,False,#SSClassicCigarillos,False
696,696,swishersweets 22,Best rillo pairings for boozy holiday drinks Drop em’👇,False,False,None,False
697,697,swishersweets 692,What’s your favorite MachineGunKelly track Tag someone who needs to hear it  live at on August 17th and get your tickets now at httpsapswishersweetscomphilly    ,False,False,#PackNightPhilly  #MachineGunKelly  #TheGunner  #MGK  #SwisherSweets  #PhillyMusic  #PhillyNews  #SwisherArtistProject,False
698,698,swishersweets 686,No lighter No problem     ,False,False,#Summertime  #SwisherSweets  #SmokeItUp  #LightItUp  #Exclusive  #Cigarstagram,False
699,699,swishersweets 719,Less than one month until the Tour kicks off in LA with LifeofDesiigner Check out the Highlight on our profile to learn more about him    ,False,False,#SwisherArtistProject  #SwisherSweets  #Swisher  #SwisherSweet  #Desiigner  #LifeofDesiigner  #LA  #LiveMusic  #HipHop,False
700,700,swishersweets 725,Prepare for Pandamonium LifeOfDesiigner headlines LA Pack Night on June 16th RSVP now using the link in our bio    ,False,False,#SwisherSweets  #SwisherArtistProject  #HipHop  #ComingSoon  #Desiigner  #LifeOfDesiigner,False
701,701,swishersweets 731,Meet the future of hip hop  We searched far and wide to discover the most promising new artists to represent the Class of 2018 Meet this year’s new talent in the video and stay tuned for an exciting announcement about this year’s headliners     dicesoho poncedeleioun labritney snapdogg chillmoody shawnsmithstory taylorjtakeover onlyoneiman dripsetfreaky kelechief qmoneyyyy thedontoliver rizzoorizzoo officialjsoulja charlesbryanlax,False,False,#SwisherArtistProject ,False
702,702,swishersweets 269,Introducing the  Make your voice heard with your vote for the next Swisher Sweets blend All you need to do is hit the link in the bio and vote for your favorite blend once per day Voting ends on 228 ,False,False,#BlendBattle #Lettheblendbattlebegin,False
703,703,swishersweets 241,Please hold Fresh kicks loading ,False,False,#SSGear,False
704,704,swishersweets 527,Steady stacking Green Get your Green Sweets now    ,False,False,#SwisherSweets  #GreenSweets  #SmokeBreak  #MiniCigarillos  #Swishers  #Cigarstagram  #cigarsofinstagram  #LightItUp  #SinceDayOne,False
705,705,swishersweets 533,Need a quick break MINI Green Sweets are here Click the link in our bio to find them     ,False,False,#SwisherSweets  #GreenSweets  #SmokeBreak  #MiniCigarillos  #Swishers  #Cigarstagram  #cigarsofinstagram  #LightItUp  #SinceDayOne,False
706,706,swishersweets 255,Its only right you save the sweetest of the Swisher Sweets for the weekend,False,False,None,False
707,707,swishersweets 282,Double tap to clink a glass with our girl justinavalentine,False,False,None,False
708,708,swishersweets 296,DJ Nano is kicking things off tonight Were heating up in here,False,False,None,False
709,709,swishersweets 292,We think we love him tylayaweh gave us all the feels last night,False,False,None,False
710,710,swishersweets 286,Who’s ready for our BRAND NEW merch to drop Comment below and we’ll DM you a discount code,False,False,None,False
711,711,swishersweets 279,Were not even mad that its cold outside rn because we get to rock this hoodie Go to the link in our bio to snag it,False,False,None,False
712,712,swishersweets 251,We like our Grapes in pouches,False,False,None,False
713,713,swishersweets 537,Time for a grape escape    ,False,False,#SwisherSweets  #Swishers  #SmokeBreak  #SinceDayOne  #RideOrDie  #Grape  #Cigarillos  #LightItUp,False
714,714,swishersweets 523,Come party all day and rage all night when the Artist Project invades Austin TX It’s going down at FairMarketATX on March 16th from 15pm and 8pm1am Link in Bio    ,False,False,#SwisherArtistProject   #SwisherSweets,False
715,715,swishersweets 245,Friday feels 🙌,False,False,None,False
716,716,swishersweets 709,Time for a Mini break    ,False,False,#SwisherSweets  #Swishers  #SmokeBreak  #MiniCigarillos  #LightItUp  #DiamondClassic  #Swisher,False
717,717,swishersweets 735,Government take all your green on  We got you    ,False,False,#TaxDay #SwisherSweets  #Swisher  #SwisherSweet  #TaxDay2018  #WeFeelYou  #GreenSweets  #GotYourBack,False
718,718,swishersweets 721,See no evil speak no evilonly  This exclusive blend has arrived but you can only cop Boozy Watermelon at 7eleven so GET THERE    ,False,False,#Swishers #SwisherSweets  #Exclusive  #7Eleven  #BoozyWatermelon  #LimitedEdition  #Watermelon,False
719,719,swishersweets 26,You better recognize ,False,False,#SSClassicCigarillos,False
720,720,swishersweets 32,And goodnight ,False,False,#SSBLK,False
721,721,swishersweets 682,Coastal Cocktail is making waves from coast to coast What’s your take on this Limited Edition blend of kiwi and peach    ,False,False,#SwisherSweets  #LimitedEdition  #CoastalCocktail  #CoastalVibes  #Summer  #Tropical  #Kiwi  #Peach,False
722,722,swishersweets 696,Tag someone you’d share your last Limited Edition Coastal Cocktail with    ,False,False,#CoastalCocktail  #SwisherSweets  #LimitedEdition   #SmokeBreak  #LightItUp  #Swishers  #Cigarstagram  #SmokeofTheDay,False
723,723,swishersweets 669,Holding isn’t a penalty in this jersey Get yours and save 20 off at swishergearcom with coupon code JERSEY20 Link in bio    ,False,False,#FootballSeason  #Jersey  #SwisherSweets  #FootballJersey  #Swishers  #Swag  #LinkInBio  #ShopNow  #FootballsBack,False
724,724,swishersweets 641,Flex this Fall with official Swisher merch Save 20 with coupon code SWISHER20 Link in bio,False,False,None,False
725,725,swishersweets 127,If you can see this youre on the list Level up that smoke sesh with the only cigarillo fit for the VIP section Whos crushing some Leaf Cognac tn,False,False,None,False
726,726,swishersweets 133,Tearing into a Thursday night like,False,False,None,False
727,727,swishersweets 655,This shield keeps the fakes away    ,False,False,#Cigarstagram  #Cigarillos  #Strawberry  #Swishers  #SinceDayOne  #Classic  #TheOriginal  #SmokeBreak,False
728,728,swishersweets 480,All eyes on Cardi at this year’s Spark Award Party    ,False,False,#SparkParty2019  #SwisherArtistProject,False
729,729,swishersweets 494,Anytime is a good time for a MINI break    ,False,False,#SwisherSweets  #StickySweets  #SmokeBreak  #MiniCigarillos  #LightItUp  #SinceDayOne  #SaturdayNight,False
730,730,swishersweets 319,When you only got one thing on ya mind,False,False,None,False
731,731,swishersweets 325,Thirsty Thursday isnt complete without a pair of Diamonds,False,False,None,False
732,732,swishersweets 443,Tag a friend who is still sleeping on Limited Edition Cherry Dynamite,False,False,None,False
734,734,swishersweets 331,Get you a gang who you can light up with,False,False,None,False
735,735,swishersweets 456,SUMMER👏 VIBES👏 ONLY 👏 Link in bio to stock up    ,False,False,#SmokeBreak  #LightItUp  #Swishers  #SwisherSweets  #Cigarstagram  #Cigarillos  #SinceDayOne  #SummerVibes  #LimitedEdition  #LemonTwist,False
736,736,swishersweets 330,Its the last night of the decade Party accordingly and party responsibly,False,False,None,False
737,737,swishersweets 324,Big mood right here,False,False,None,False
738,738,swishersweets 442,Summer is Tropical blend szn,False,False,None,False
739,739,swishersweets 318,Dont be stingy with those Swisher Sweets Get an extra pouch for the party,False,False,None,False
740,740,swishersweets 495,Call up the crew and get it goin Whos ready to     ,False,False,#TearIntoTheWeekend #SwisherSweets  #Swishers  #SmokeBreak  #SinceDayOne  #Cigarillos  #LightItUp  #TearIntoTheWeekend,False
741,741,swishersweets 481,The Spark Party was Major lit Wish you were there 👀    ,False,False,#SparkParty2019  #SwisherArtistProject  #SparkAward2019,False
742,742,swishersweets 132,Always keep a little something up your sleeve Like a fresh pouch of BLK Smooth,False,False,None,False
743,743,swishersweets 654,ANOTHA ONE Thank you to all the fans who showed out to make this the third sold out Pack Night in a row 🤟 loves you Atlanta    ,False,False,#SwisherArtistProject  #SwisherArtistProject  #SwisherSweets  #GucciMane  #GucciManeLaFlare  #ATL  #ATLiens  #ATLRappers  #ATLMusic  #ATLMusicScene,False
744,744,swishersweets 640,⏱ There’s only one week left to apply for the Desiigner X Swisher Sweets Grant Go to the link in our bio to apply,False,False,None,False
745,745,swishersweets 126,Sliiiiiide into the weekend in style Fresh swag available now at swishergearcom,False,False,None,False
746,746,swishersweets 668,We don’t have to tell you that MachineGunKelly killed at but we are still in awe over the talent and energy that ShawnSmithStory chillmoody and OnlyOneIman brought to the stage Go vote to send your favorite new artist to the NOLA Takeover at apswishersweetscomphilly ,False,False,#PackNightPhilly  #LinkInBio  #Philly  #SwisherArtistProject  #PackNightPhilly  #Classof2018  #HipHop  #PhillyRapNews  #MGK,False
747,747,swishersweets 697,Coastal Cocktail is now available at convenience stores from coast to coast Try our latest Limited Edition a refreshing blend of kiwi and peach    ,False,False,#CoastalCocktail  #SwisherSweets  #LimitedEdition   #SmokeBreak  #LightItUp  #Swishers  #Cigarstagram  #SmokeofTheDay,False
748,748,swishersweets 683,Time for a  What’s your favorite blend    ,False,False,#SwisherBreak #SwisherSweets  #Swishers  #SmokeBreak  #Cigarstagram  #LightItUp  #SmokeOfTheDay  #SundayFunDay,False
749,749,swishersweets 33,The standard since 1958 Who’s firing up a Swisher Sweets OG Red Cigarillo tn ,False,False,#SSClassicCigarillos,False
750,750,swishersweets 27,This is your chance to cop that Camo look fam Score the deal with 40 OFF  FREE SHIPPING on ALL of our merch ,False,False,#SSGEAR  #BlackFridaySale  #LinkInBio,False
751,751,swishersweets 720,One for me one for you Tag who youd give your last to below    ,False,False,#Swisher  #SwisherSweets  #Chocolate  #SmokeBreak  #Cigarillo  #LightItUp  #SmokeSesh,False
752,752,swishersweets 734,🚨Some friends of ours have a BIG announcement coming your way Check back on Friday to find out what it is,False,False,None,False
