index,Unnamed: 0,id,text,exp_tag,amb_tag,extract_tag,tobacco_warning
296,296,swishersweets 560,The 2018 Artist Project is going out with a bang tonight in New Orleans starts now    ,False,False,#NOLATakeover  #SwisherArtistProject   #SwisherSweets,False
297,297,swishersweets 574,Why wait for the afterparty Tear into the weekend with Swisher Sweets Don’t forget to cop your tix to     ,False,False,#NOLATakeover  #SwisherSweets  #Swishers  #SmokeBreak  #SinceDayOne  #TearIntoTheWeekend  #Pregame  #Afterparty  #Concert  #LiveMusic,False
298,298,swishersweets 212,You thought you lost your chance Well we’re giving away ANOTHA ONE to another responsible follower to help curb the boredom  All you have to do is let us know below where your favorite place to smoke is Go off NO PURCHASE NECESSARY Void where prohibited Must be legal US resident 21 See link in bio for full rules Each person that submits a comment will receive an entry in the sweepstakes,False,False,#SocialDistancing  ,False
299,299,swishersweets 548,Who are you sharing your Swisher with today    ,False,False,#SwisherSweets  #Swishers  #SmokeBreak  #SinceDayOne  #RideOrDie  #Cigarillos  #LightItUp  #Classic,False
300,300,swishersweets 589,WHO’S READY FOR NOLA Cop your tickets today while they’re 50 off Link in bio    ,False,False,#FlashSale  #SwisherArtistProject  #SwisherSweets  #NOLATakeover,False
301,301,swishersweets 238,If you aren’t down with the boss yellabeezy214 consider this your final chance Get to know the Class of 2020 artist here,False,False,None,False
302,302,swishersweets 562,is our biggest party of the year All four headliners six new artists and DJ Mannie Fresh take the stage in New Orleans on December 28th Tickets are almost gone and going fast Get yours now Link in bio    ,False,False,#NOLATakeover  #PackNight  #SwisherSweets  #Swishers  #SwisherArtistProject  #NOLAHipHop  #MGK  #Est4life  #GucciMane  #laflare1017  #FettyWap1738  #Desiigner  #Panda  #NOLA  #NewOrleans,False
303,303,swishersweets 204,Don’t Miss This Who thinks they can name all the Swisher Sweets Limited Editions… EVER  Do it and this laptop could be yours as a thank YOU from us for practicing safe social distancing As always 24 hours only to qualify NO PURCHASE NECESSARY Void where prohibited Must be legal US resident 21 See link in bio for full rules Each person that submits a comment will receive an entry in the sweepstakes,False,False,#SocialDistancing  ,False
304,304,swishersweets 210,Treat yourself to a SMOOTH smoke break ,False,False,#BLK,False
305,305,swishersweets 576,Who’s your ride or die Tag em     ,False,False,#SwisherSweets  #Swishers  #SmokeBreak  #SinceDayOne  #Classic  #CrewLove  #LightItUp,False
306,306,swishersweets 748,Diamonds shinin so hard they blindin,False,False,None,False
307,307,swishersweets 760,Tag someone you want to share a Limited Edition Maui Pineapple with 👇👇👇,False,False,None,False
308,308,swishersweets 774,Hey handsome Tag someone you think would kill it in this exclusive camo longsleeve and pick one up at wwwswishergearcom,False,False,#SwisherSweets ,False
309,309,swishersweets 73,Nothing but good vibes this weekend fam  ,False,False,#LifeIsSweet  #SSArtistProject  #ArtistProject,False
310,310,swishersweets 67,Time is running out fam We’re awarding 10k with the RAGER BØY TylaYaweh to the next big act to come out of central Florida  If you think that’s you RUN to the link in our bio and submit the application before 1012 ,False,False,#Orlando  #LifeisSweet  #SSArtistProject   #SSAPGRANT,False
311,311,swishersweets 199,Its not about a lifestyle its about living life to the fullest Who is puff puff passing virtually tonight Drop a 🖐️ below ,False,False,#LifeIsSweet,False
312,312,swishersweets 9,Get those orders in ASAP to cop your NYE look for 25 off  free shipping at the link in bio ,False,False,#SSGear,False
313,313,swishersweets 628,Unbreakable     ,False,False,#SwisherSweets  #SwisherDiamond  #Swisher  #SinceDayOne  #SmokeBreak  #LightItUp,False
314,314,swishersweets 172,If youre not smoking a Swisher Sweet while wearing some Swisher Sweets what are you even doing ,False,False,#SSGear,False
315,315,swishersweets 614,Tag your pong partner and get ready for the weekend    ,False,False,#SwisherDiamond  #Swisher  #SwisherSweets  #SinceDayOne  #SwisherClassic  #SmokeBreak  #LightItUp,False
316,316,swishersweets 600,We’re sticking with sticky Look for the latest Encore Edition in stores starting January 2019    ,False,False,#StickySweets  #EncoreEdition  #SwisherSweets  #Swisher  #SinceDayOne  #SwisherClassic  #SmokeBreak,False
317,317,swishersweets 98,Double tap if this is the move tonight 💨,False,False,None,False
318,318,swishersweets 166,Who’s puffing a Banana Daiquiri by the pool this week,False,False,None,False
319,319,swishersweets 358,It may be cuffing season but that doesnt mean you have to share your Purple Swish ,False,False,#JustSayin,False
321,321,swishersweets 370,Twinning Tag your partner in crime 👯,False,False,None,False
322,322,swishersweets 364,Who’s about that puffpuff Passion fruit life,False,False,None,False
323,323,swishersweets 402,Red white and Swishers all over ,False,False,#LDW,False
324,324,swishersweets 365,Nothing says Fall like Honey Leaf,False,False,None,False
325,325,swishersweets 403,Stocking up for  Comment below with your BBQ essentials,False,False,#LDW,False
326,326,swishersweets 417,No shirt no shoes but def bring the blues    ,False,False,#SmokeBreak  #LightItUp  #Swishers  #SwisherSweets  #Cigarstagram  #Cigarillos  #SinceDayOne  #SummerVibes  #Blueberry  #Classics,False
327,327,swishersweets 371,Pop quiz How many Classics can you name Don’t check the comments just type 👇,False,False,None,False
328,328,swishersweets 359,Don’t show up to Friendsgiving empty handed,False,False,None,False
329,329,swishersweets 99,Show out 👇,False,False,None,False
330,330,swishersweets 601,Monday Mood    ,False,False,#MondayMood  #Swisher  #SwisherSweets  #SinceDayOne  #WildRush  #SmokeBreak  #LightItUp,False
331,331,swishersweets 167,What BLK are you grabbing to smoke away the Sunday scaries ,False,False,#BLKBerry,False
332,332,swishersweets 173,Whose Mom is getting smokes today instead of flowers Tag them below,False,False,None,False
333,333,swishersweets 615,Don’t sleep on Limited Edition Coco Blue fam It won’t be around forever    ,False,False,#CocoBlue  #SwisherSweets  #Swisher  #SinceDayOne  #SmokeBreak  #LightItUp,False
334,334,swishersweets 629,Straight out the vault,False,False,None,False
335,335,swishersweets 8,TylaYaweh surprises artist lilgoyaxo with a 10000 Swisher Sweets Artist Project Hometown Grant check Lil Goyas journey has just begun and we are here for it ,False,False,#Orlando  #SSArtistProject  #SSAPGrant  #LifeIsSweet,False
336,336,swishersweets 66,Nothing basic about it Grab yours at swishergearcom,False,False,None,False
337,337,swishersweets 198,By now you should be the GOATS of social distancing but we know its tough Thats why were giving away ANOTHER FLATSCREEN to the   Drop the name of your ALL TIME favorite blend below and well send one of you a brand new TV to swag up your quarantine crib 24 hours to enter startsnow NO PURCHASE NECESSARY Void where prohibited Must be legal US resident 21 See link in bio for full rules Each person that submits a comment will receive an entry in the sweepstakes By now you should be the GOATS of social distancing but we know its tough Thats why were giving away ANOTHER FLATSCREEN to the   Drop the name of your ALL TIME favorite blend below and well send one of you a brand new TV to swag up your quarantine crib 24 hours to enter startsnow NO PURCHASE NECESSARY Void where prohibited Must be legal US resident 21 See link in bio for full rules Each person that submits a comment will receive an entry in the sweepstakes,False,False,#SwisherFam #SocialDistancing   #SwisherFam #SocialDistancing  ,False
338,338,swishersweets 72,Whos smoking that good grape ,False,False,#SSClassicCigarillos,False
339,339,swishersweets 775,For a smashing good time call on our newest addition to the Encore Edition lineup  BANANA SMASH,False,False,None,False
340,340,swishersweets 761,Straight to the dome Swisher available at wwwswishergearcom ,False,False,#snapbacks  #LinkInBio,False
341,341,swishersweets 749,Seeing double Double Barrel Rum that is,False,False,None,False
342,342,swishersweets 211,Who thinks they can predict what blend is coming out this season  Get it right and you could be the lucky winner to take home this laptop to curb the quarantine boredom NO PURCHASE NECESSARY Void where prohibited Must be legal US resident 21 See link in bio for full rules Each person that submits a comment will receive an entry in the sweepstakes,False,False,#SocialDistancing  ,False
343,343,swishersweets 577,Sure sign of a good time What blend you got tonight Comment below     ,False,False,#SwisherSweets  #Swishers  #SmokeBreak  #SinceDayOne  #VIP  #BlowingSmoke  #LightItUp  #Cigarstagram  #Chocolate,False
344,344,swishersweets 563,In just two days the hosts the 2nd Annual  Will you be there  Ticket link in bio     ,False,False,#SwisherArtistProject  #NOLATakeover #SwisherSweets  #Swishers  #SwisherArtistProject  #NOLAHipHop  #MGK  #Est4life  #GucciMane  #laflare1017  #FettyWap1738  #Desiigner  #Panda  #NOLA  #NewOrleans,False
345,345,swishersweets 205,Who is highkey excited to light up some Leaf tn,False,False,None,False
346,346,swishersweets 239,Hear the secret to success straight from our guy dababy the 2020 Spark Award Recipient,False,False,None,False
347,347,swishersweets 588,You already know whats going on    ,False,False,#WildRush  #EncoreEdition  #Swisher  #SwisherSweets  #SinceDayOne  #SmokeBreak  #LightItUp,False
348,348,swishersweets 585,Swishers and chill    ,False,False,#SwisherSweets  #Swishers  #SmokeBreak  #SinceDayOne  #RideOrDie  #Cigarillos  #LightItUp  #Diamond,False
349,349,swishersweets 591,CHILL LEVEL 1000    ,False,False,#CocoBlue  #Swisher  #SwisherSweets  #SinceDayOne  #SmokeBreak,False
350,350,swishersweets 220,WIN some swag for the next 15 days while you are home practicing social distancing  To kick things off comment below and tell us what you’re doing during your quarantine time and you could win this FREE flat screen TV For each prize have 24 hours to qualify get going people NO PURCHASE NECESSARY Void where prohibited Must be legal US resident 21 See link in bio for full rules Each person that submits a comment will receive an entry in the sweepstakes WIN some swag for the next 15 days while you are home practicing social distancing  To kick things off comment below and tell us what you’re doing during your quarantine time and you could win this FREE flat screen TV For each prize have 24 hours to qualify get going people NO PURCHASE NECESSARY Void where prohibited Must be legal US resident 21 See link in bio for full rules Each person that submits a comment will receive an entry in the sweepstakes,False,False,#SocialDistancing   #SocialDistancing  ,False
351,351,swishersweets 546,Who’s ready for the next Limited Edition Any guesses as to what it will be    ,False,False,#SwisherSweets  #Swishers  #SmokeBreak  #SinceDayOne  #RideOrDie  #BoozyWatermelon  #Cigarillos  #LightItUp,False
352,352,swishersweets 552,Are you on  Tag your squad    ,False,False,#TeamSwisher #SwisherSweets  #Swishers  #SmokeBreak  #SinceDayOne  #RideOrDie  #Cigarillos  #LightItUp,False
353,353,swishersweets 234,Get to know melii from the Artist Project Class of 2020,False,False,None,False
354,354,swishersweets 208,OK fam well do another one Win a fly new laptop to social distance in style TODAY ONLY  Drop your area code below so we know where youre repping for a chance to win NO PURCHASE NECESSARY Void where prohibited Must be legal US resident 21 See link in bio for full rules Each person that submits a comment will receive an entry in the sweepstakes,False,False,#SocialDistancing  ,False
355,355,swishersweets 787,Embrace and stay fly af with the OFFICIAL hooded sweatshirt Cop it at the link in our bio,False,False,#HoodieSeason  #SwisherSweets ,False
356,356,swishersweets 793,Something new is coming soon Stay tuned…,False,False,None,False
357,357,swishersweets 744,Now this is something you can really sink your teeth into,False,False,None,False
358,358,swishersweets 750,We just dropped count em THREE CStore Session videos featuring urdjuice in Detroit Slide over to our YouTube Channel to watch and while you’re there don’t forget to Subscribe ,False,False,#LinkInBio,False
359,359,swishersweets 778,Pocketsized but highly prized,False,False,None,False
360,360,swishersweets 195,Were always here for some wine Leave a 🍷 if you feel the same,False,False,None,False
361,361,swishersweets 181,We can all use a Swisher Sweet rn  Head to your local cstore to grab some Limited Edition Banana Daiquiri,False,False,None,False
362,362,swishersweets 57,Get tippy with it ,False,False,#SSBLK,False
363,363,swishersweets 5,This is how we wine down after the holidays ,False,False,#SSBLK,False
364,364,swishersweets 43,Purple is always the play ,False,False,#SSClassicCigarillos,False
365,365,swishersweets 803,When you go to the store for some Swishers and walk into a BOB show Keep an eye out for the debut of the latest edition of our CStore Sessions pop up concert series,False,False,None,False
366,366,swishersweets 630,Which Swisher blend are you holding rn,False,False,None,False
368,368,swishersweets 142,You dont need a getaway to get away Just a quiet spot and the BLK of your choice,False,False,None,False
369,369,swishersweets 624,Who’s tearing into Tropical Fusion this weekend     ,False,False,#SwisherSweets  #Swisher  #SinceDayOne  #SmokeBreak  #LightItUp,False
370,370,swishersweets 94,We got your right here Cop your own bucket tee and slides at swishergearcom,False,False,#OOTD ,False
371,371,swishersweets 80,Twilight That time when the day is over but the night is just beginning Welcome to the sweetest hour of them all how are you making the most of it ,False,False,#LifeIsSweet,False
372,372,swishersweets 618,The coldest in the game ❄ Bundle up and come see laflare1017 at the 2nd Annual NOLA Takeover     ,False,False,#LinkInBio  #GucciMane  #SwisherArtistProject  #NOLATakeover,False
373,373,swishersweets 397,Don’t mind if I do,False,False,None,False
374,374,swishersweets 383,Squad Goals,False,False,None,False
375,375,swishersweets 354,Everyone’s out there looking for deals but we’re like,False,False,None,False
376,376,swishersweets 432,Feelin’ patriotic with these three today 🇺🇸 comment below which blend you’re representing with ,False,False,#Happy4th,False
377,377,swishersweets 426,Yeah fam we went there Mango  Passion Fruit bring the summer vibes straight to your Swisher Tag a friend to spread the passion,False,False,None,False
378,378,swishersweets 340,Whos gonna be on the naughty list with you this year  them below,False,False,None,False
379,379,swishersweets 368,Drop a ✋if you mess with White Grape,False,False,None,False
380,380,swishersweets 369,Leave the rest behind it’s leaf season,False,False,None,False
381,381,swishersweets 427,You cant fake that Classic style,False,False,None,False
382,382,swishersweets 341,Weve been keeping this one a secret for A LONG TIME Introducing Swisher Sweets Silver Hit the link it our bio to find it near you,False,False,None,False
383,383,swishersweets 355,When your Grandma asks you to pass the Leaf ,False,False,#HappyThanksgiving,False
384,384,swishersweets 433,Get in the center of the Shaqtion with this exclusive interview ,False,False,#SummerTwist,False
385,385,swishersweets 382,Tag your Friday crew and let em know what blend youre rolling up to the party with,False,False,None,False
386,386,swishersweets 396, a friend who accessorizes with Limited Editions,False,False,None,False
387,387,swishersweets 619,When it comes to Tropical Fusion there’s no confusion     ,False,False,#SwisherSweets  #Swisher  #SinceDayOne  #SmokeBreak  #LightItUp,False
388,388,swishersweets 81,Tag away Weve got tylayaweh,False,False,None,False
389,389,swishersweets 95,It’s wild to say but we believe it  fam So be generous with the love when you’re out and aboutjust show it from a distance After all it’s the little moments that remind us that   Drop a 👋  to a longlost friend below,False,False,#LifeIsSweet #LifeIsSweet,False
390,390,swishersweets 143,Grab that Monday Swisher Sweets and spark the lighter fam You earned it,False,False,None,False
391,391,swishersweets 625,On sale now Gucci Mane MGK Fetty Wap  Desiigner coheadline the 2nd Annual NOLA Takeover Dec 28th    laflare1017 lifeofdesiigner machinegunkelly fettywap1738,False,False,#Linkinbio  #SwisherSweets  #NOLATakeover  #NOLA  #SwisherArtistProject  #NewYearsEve ,False
392,392,swishersweets 631,One for me one for you,False,False,None,False
394,394,swishersweets 802,The remedy for rush hour ,False,False,#WildRush,False
395,395,swishersweets 42,So fresh and so 🔥 So fresh and so 🔥,False,False,None,False
396,396,swishersweets 56,Tap it to pass it ,False,False,#SSLeaf,False
397,397,swishersweets 4,What would you do if TylaYaweh showed up at your door Head to IGTV to watch more ,False,False,#SSAPGrant  #SSArtistProject  #LifeisSweet,False
398,398,swishersweets 180,If you havent stocked up on Swisher Sweets gear what are you waiting for Get your summer fit now ,False,False,#SSGear,False
399,399,swishersweets 194,The LAST prize goes to… Thanks to everyone for tuning in to win some awesome prizes while practicing social distancing  Tag below who you can’t wait to see once the quarantine is over and you could have this TV on its way to you As always 24 hours only to qualify NO PURCHASE NECESSARY Void where prohibited Must be legal US resident 21 See link in bio for full rules Each person that submits a comment will receive an entry in the sweepstakes,False,False,#SocialDistancing  ,False
400,400,swishersweets 779,Imagine yourself on the BIG stage Think you got the skills to take your music career to the next level We’re looking for the next group of emerging artists to join the Class of 2018 Apply today using the link in our bio,False,False,#SwisherArtistProject ,False
401,401,swishersweets 751,For those proud to make their own path ,False,False,#RoughCut,False
402,402,swishersweets 745,Rustic raw and made for the modern day Outlaw ,False,False,#SwisherSweetsOutlaws,False
403,403,swishersweets 792,Ugggggggh six more weeks of winter Thanks for nothing Phil ,False,False,#GroundhogDay,False
404,404,swishersweets 786,It’s here  Say aloha to the latest blend  Maui Pineapple is in stores now but only for a limited time,False,False,#SwisherFans #LimitedEdition ,False
405,405,swishersweets 209,Down in the dumps cause you didn’t win a flat screen the past three days  Well we’re back with another opportunity to win as a THANK YOU from Swisher Sweets for socially distancing yourself and being responsible Comment below to let us know your funniest of all time smoking story to win NO PURCHASE NECESSARY Void where prohibited Must be legal US resident 21 See link in bio for full rules Each person that submits a comment will receive an entry in the sweepstakes Down in the dumps cause you didn’t win a flat screen the past three days  Well we’re back with another opportunity to win as a THANK YOU from Swisher Sweets for socially distancing yourself and being responsible Comment below to let us know your funniest of all time smoking story to win NO PURCHASE NECESSARY Void where prohibited Must be legal US resident 21 See link in bio for full rules Each person that submits a comment will receive an entry in the sweepstakes,False,False,#SocialDistancing   #SocialDistancing  ,False
406,406,swishersweets 553,Double tap if you keep a Swisher on deck at all times    ,False,False,#SwisherSweets  #Swishers  #SmokeBreak  #SinceDayOne  #Cigarillos  #LightItUp,False
407,407,swishersweets 235,This pocket tee is COMF Grab one for Spring,False,False,None,False
408,408,swishersweets 221,This year its no joke Happy Hour starts now  Swisher Sweets Limited Edition Banana Daiquiri in storesfor real,False,False,None,False
409,409,swishersweets 547,2 friends 1 swisher Tag your go to    ,False,False,#SwisherSweets  #Swishers  #SmokeBreak  #SinceDayOne  #RideOrDie  #CocoBlue  #Cigarillos  #LightItUp,False
410,410,swishersweets 590,Only 3 days left to enter the NOLA Takeover Sweepstakes Hit the link in our bio to win travel hotel and VIP tickets for 2 to the Artist Project’s biggest party to date    ,False,False,#SwisherArtistProject  #NOLATakeover  #Sweepstakes  #Linkinbio,False
411,411,swishersweets 584,Sweet like a Georgia Peach 🍑     ,False,False,#SwisherSweets  #Swishers  #SmokeBreak  #SinceDayOne  #Cigarstagram  #Peach,False
412,412,swishersweets 592,Shop httpswishergearcom and use coupon code CYBER40 to save 40 in our entire online store    ,False,False,#SweetDeals  #CyberMonday  #Swisher  #SwisherSweets  #SinceDayOne  #SmokeBreak  #LightItUp,False
413,413,swishersweets 586,What are you smoking today  Comment below 👇👇    ,False,False,#SwisherSweets  #Swishers  #SmokeBreak  #SinceDayOne  #Smoking  #LightItUp,False
414,414,swishersweets 237,That’s the tylayaweh motto and we’re bringing it with us all through 2020 Educate yourself on the Class of 2020 artist with this interview,False,False,None,False
415,415,swishersweets 551,You got that gear Keep it fresh in 2019 with official Swisher merchandise Link in bio to shop    ,False,False,#SwisherSweets  #Swishers  #SwisherMerch  #SmokeBreak  #SinceDayOne  #Cigarillos,False
416,416,swishersweets 545,in full effect Who are you kicking it with today    ,False,False,#SundayFunday  #SwisherSweets  #Swishers  #SmokeBreak  #SinceDayOne  #SundayFunDay  #BananaSmash  #Cigarillos  #LightItUp,False
417,417,swishersweets 223,What’s up fools It’s April 1 The wait is over Can you call our blend this year,False,False,None,False
418,418,swishersweets 579,Sundays are for the boys Tag your gameday crew     ,False,False,#SwisherSweets  #Swishers  #SmokeBreak  #SinceDayOne  #VIP  #BlowingSmoke  #LightItUp,False
419,419,swishersweets 790,ONE TEAM ONE LOVE It doesn’t matter where you’re from or what team you root for we’re all TEAM SWISHER Cop this heat in the online shop at the link in our bio,False,False,#SwisherGear ,False
420,420,swishersweets 784,Looking for something a little more rough around the edges  Get hype to outlawscigars,False,False,None,False
421,421,swishersweets 753,Swisher Sweets Outlaws are as bold as the people who smoke them Swipe to meet some of our posse,False,False,None,False
422,422,swishersweets 747,It’s dinner time Check out our new Limited Edition Dinner Series lineup and leave a comment with another classic dish you think would make a great blend,False,False,None,False
423,423,swishersweets 182,Nothing fresher than a new fit ,False,False,#SSGear,False
424,424,swishersweets 196,We want to applaud y’all for doing your part in keeping society safe Peace love and Swisher Sweets  Comment below what you’re grateful for in the world rn for one of your last chances to win a free laptop NO PURCHASE NECESSARY Void where prohibited Must be legal US resident 21 See link in bio for full rules Each person that submits a comment will receive an entry in the sweepstakes,False,False,#SocialDistancing  ,False
425,425,swishersweets 68,Its the weekend Get that game face on,False,False,None,False
426,426,swishersweets 40,Bling Bling Bling ,False,False,#SSMINIS,False
427,427,swishersweets 800,Setting the standard since 1958,False,False,None,False
428,428,swishersweets 6,‘Tis the season to celebrate the ones who’ve always been there Whether youre celebrating virtually or inperson we hope you have a safe and happy holiday ,False,False,#LifeIsSweet,False
429,429,swishersweets 54,All blinged up like Gucci ,False,False,#SSMINI,False
430,430,swishersweets 627,What’s your goto Swisher blend     ,False,False,#SwisherSweets  #SwisherMango  #SinceDayOne  #SmokeBreak  #LightItUp,False
431,431,swishersweets 141,If you like our Original pouch youll love the remix Heat up that summer smoke sesh with one of our four pouches ft the OG Swisher Sweets Original Red cigarillo inside Hurry up fam cause these WILL run out If you like our Original pouch youll love the remix Heat up that summer smoke sesh with one of our four pouches ft the OG Swisher Sweets Original Red cigarillo inside Hurry up fam cause these WILL run out ,False,False,#SummerEdition  #SummerPromo  #SummerIsSweet  #SummerEdition  #SummerPromo  #SummerIsSweet,False
433,433,swishersweets 633,Better pack some Black,False,False,None,False
434,434,swishersweets 83,Which blend gets you cheesing like this ,False,False,#SSClassicCigarillos,False
435,435,swishersweets 169,The sun is setting on Friday night Time to light up and let the week roll off your shoulders ,False,False,#LifeIsSweet,False
436,436,swishersweets 97,Always keep some spare Diamonds on deck Always keep some spare Diamonds on deck ,False,False,#SSClassicCigarillos  #SSClassicCigarillos,False
437,437,swishersweets 380, a girl whose got good taste,False,False,None,False
438,438,swishersweets 394,Dont leave her hanging,False,False,None,False
439,439,swishersweets 343,📣🎉MIAMI🎉📣 Swisher Sweets Artist Project presents dababy at shaqsfunhouse during the Big Game Weekend TIX on sale Thursday at 11AM EST at the link in our bio Stay tuned for ticket giveaways  more artists TBA,False,False,None,False
440,440,swishersweets 425,Leave the rest behind Leaf is here,False,False,None,False
441,441,swishersweets 431,Fam we’ve got BIG news coming this week Stay tuned 👀,False,False,None,False
